{
  "$schema": "https://json-schema.org/draft/2020-12/schema",
  "type": "object",
  "additionalProperties": false,
  "required": [
    "schema_version",
    "business",
    "administrator",
    "settings"
  ],
  "properties": {
    "schema_version": {
      "const": "1.0"
    },
    "business": {
      "type": "object"
    },
    "administrator": {
      "type": "object"
    },
    "settings": {
      "type": "object"
    }
  }
}